{
  "contractId": "VP-H2N-NUMERICAL-BACKEND-QUALIFICATION-CONTRACT-v1",
  "schemaVersion": "VP-H2N-NUMERICAL-BACKEND-QUALIFICATION-SCHEMA-v1",
  "classification": "candidate-only-nonexact-backend-numerical-qualification",
  "pr2Decision": {
    "commit": "d079d933c3afdfd78927ca857bdb94d784e085cf",
    "relativePath": "90_候选工作区/current/G0_全项目完成度与实验前暂停治理/07_PR2_HW2测量语义执行架构与全项目后续裁决.md",
    "sha256": "2631cda368e04d0d100150170b7eff5551d81e8305953915881a3a615931d4a1",
    "requiredCode": "REQUIRE-H2X-EXACT-EQUIVALENCE-OR-H2N-INDEPENDENT-NUMERICAL-QUALIFICATION-BEFORE-H3",
    "h3LockCode": "KEEP-HW1-PRIMARY-HW1-REPEAT-AND-H3-LOCKED"
  },
  "freeze": {
    "repositoryBaseCommit": "6e27bf2cb7c6e1679d96a1d5bdd776ecd59ed8a6",
    "resultBlind": true,
    "newBackendIdentityRequired": true,
    "candidateImplementationCommittedBeforeObservation": true,
    "formalSourceReadOnly": true,
    "scientificPayloadHumanReadForbidden": true,
    "canonicalA8rArtifactWriteForbidden": true,
    "fullEightCaseResultBearingRunForbidden": true,
    "runtimeFallbackForbidden": true,
    "formalTheoryAndProgramImmutable": true,
    "thresholdMutationAfterStage0Forbidden": true
  },
  "referenceBindings": [
    {
      "relativePath": "02_模拟程序/src/solvers/highFidelity/lbm.ts",
      "sha256": "6949dd9f215595bde4162078f9cb026456bcbed83fd2ebd08131001e03ec2dc2",
      "role": "formal-typescript-reference",
      "accessMode": "read-only-import"
    },
    {
      "relativePath": "90_候选工作区/current/A8_二维特征开放边界实验后端/src/brinkman-multiresolution-contract-v2-1.ts",
      "sha256": "c629337a7199f6c51a23735ca75432eaa5019b633afcf8fb4f908a6f723c335b",
      "role": "frozen-a8r-case-and-parameter-source",
      "accessMode": "read-only-import"
    },
    {
      "relativePath": "90_候选工作区/current/A8_二维特征开放边界实验后端/src/brinkman-multiresolution-support-v2-1.ts",
      "sha256": "ff03aeaab0d8ab7b94277e803f007db6d9b36e4da7ca1ac6f046e311b158ba36",
      "role": "independent-force-identity-reference",
      "accessMode": "read-only-import"
    },
    {
      "relativePath": "90_候选工作区/current/A8_二维特征开放边界实验后端/src/d2q9.ts",
      "sha256": "319d085cbe469446eefe38ff8e3a4658971edaf6e8ac98224d1a952cc27fba10",
      "role": "independent-d2q9-reference",
      "accessMode": "read-only-import"
    },
    {
      "relativePath": "90_候选工作区/current/H2_代表性执行与数值资格/contracts/h2x-exact-execution-equivalence.v1.json",
      "sha256": "d6727674029656e687a15b712eaee334f0eaffc5571445af379aecedc9b0ec0a",
      "role": "selected-h2x-performance-and-identity-comparator",
      "accessMode": "read-only-import"
    }
  ],
  "triggerConditions": [
    "native-openmp-simd-gpu-or-hybrid-changes-floating-point-order",
    "candidate-changes-reduction-boundary-or-data-layout",
    "candidate-cannot-pass-h2x-exact-bytes",
    "h2x-is-not-representative-best-and-h2n-expected-net-gain-exceeds-10-percent"
  ],
  "backendIdentity": {
    "requiredFields": [
      "backendId",
      "algorithmId",
      "precisionId",
      "layoutId",
      "reductionId",
      "boundaryId",
      "compilerId",
      "compilerFlags",
      "driverId",
      "deviceId",
      "implementationCommit",
      "implementationTreeSha256"
    ],
    "mustDifferFromH2xWhenBytesDiffer": true,
    "silentFallbackForbidden": true
  },
  "stage0": {
    "stageId": "H2N-STAGE0-REPRESENTATIVE-FEASIBILITY-v1",
    "fixtureSeed": "sha256:IYPT13-H2N-STAGE0-FIXTURE-v1",
    "precision": "float64",
    "operatorCoverage": [
      "d2q9-equilibrium",
      "d2q9-moments",
      "mrt-collision",
      "guo-forcing",
      "brinkman-mask",
      "brinkman-force",
      "scatter-streaming",
      "open-boundary",
      "periodic-crossflow-boundary",
      "body-null",
      "fixed-body",
      "population-accounting",
      "mass-accounting",
      "momentum-accounting",
      "force-exchange-accounting",
      "checkpoint-fields"
    ],
    "sizeMatrix": [
      {
        "sizeId": "small-d24",
        "diameterCells": 24,
        "nx": 804,
        "ny": 240,
        "steps": 32
      },
      {
        "sizeId": "medium-d36",
        "diameterCells": 36,
        "nx": 1206,
        "ny": 360,
        "steps": 24
      },
      {
        "sizeId": "representative-d54",
        "diameterCells": 54,
        "nx": 1809,
        "ny": 540,
        "steps": 16
      }
    ],
    "bodyModes": [
      "body-null",
      "fixed-body-baseline-phase",
      "fixed-body-minus-half-cell-phase"
    ],
    "checkpointSteps": [0, 1, 2, 8, "final"],
    "toleranceModel": {
      "normalizedDifference": "abs(candidate-reference)/max(abs(reference),abs(candidate),1e-15)",
      "equilibriumAndMomentMaximum": 5e-13,
      "collisionForcingStreamingBoundaryMaximum": 2e-12,
      "populationNormalizedL2Maximum": 1e-11,
      "massAndMomentumNormalizedMaximum": 1e-11,
      "rawAndA2ForceNormalizedMaximum": 5e-10,
      "checkpointFieldNormalizedL2Maximum": 1e-10,
      "nonFiniteCountMaximum": 0,
      "negativePopulationCountDifferenceMaximum": 0
    },
    "performance": {
      "coldAndSteadyStateSeparated": true,
      "formalRepeatSecondsMinimum": 15,
      "formalRepeatSecondsMaximum": 60,
      "validRepeats": 3,
      "reference": "selected-h2x-representative-end-to-end",
      "materialNetGainFractionStrictlyGreaterThan": 0.1,
      "includeTransferAuditShardAndAggregation": true
    },
    "outcomes": [
      "PASS-H2N-STAGE0-REPRESENTATIVE-FEASIBILITY",
      "NO-GO-H2N-STAGE0-NUMERIC-OR-PERFORMANCE",
      "DEFERRED-H2N-TOOLCHAIN-OR-RESOURCE",
      "DEFERRED-H2N-NO-MATERIAL-END-TO-END-GAIN"
    ]
  },
  "fullQualification": {
    "trigger": "stage0-pass-and-material-net-gain-strictly-greater-than-0.10",
    "independentReferenceRequirement": "two-independent-implementations-or-one-implementation-plus-independent-reference",
    "coverage": [
      "mass-conservation-ledger",
      "momentum-conservation-ledger",
      "every-step-brinkman-exchange",
      "raw-force",
      "a2-corrected-force",
      "boundary-negative-cases",
      "stability-envelope",
      "grid-refinement",
      "time-refinement",
      "precision-sensitivity",
      "reduction-error",
      "cross-device-determinism",
      "statistical-output-tolerance",
      "compiler-driver-and-source-identity"
    ],
    "matrix": {
      "diameterCells": [24, 36, 54],
      "maskHalfThicknessCells": [0.5, 0.75],
      "phaseIds": ["baseline", "minus-half-cell"],
      "bodyModes": ["body-null", "fixed-body"],
      "precisionModes": ["float64"],
      "reductionOrders": ["candidate-native", "deterministic-reference"]
    },
    "gates": {
      "nonFiniteCountMaximum": 0,
      "populationNormalizedL2Maximum": 1e-10,
      "massLedgerNormalizedDifferenceMaximum": 1e-10,
      "momentumLedgerNormalizedDifferenceMaximum": 1e-10,
      "everyStepBrinkmanExchangeNormalizedMaximum": 1e-9,
      "rawForceNormalizedMaximum": 1e-9,
      "a2CorrectedForceNormalizedMaximum": 1e-9,
      "boundaryFluxNormalizedMaximum": 1e-9,
      "statisticalOutputNormalizedMaximum": 1e-6,
      "gridAndTimeTrendDirectionMustMatch": true,
      "stabilityClassificationMustMatch": true,
      "allNegativeCasesMustReject": true
    },
    "negativeCases": [
      "non-finite-population",
      "invalid-relaxation-time",
      "invalid-penalization-time",
      "mask-shape-drift",
      "open-boundary-order-drift",
      "body-null-force-leak",
      "force-reduction-drift",
      "precision-downgrade",
      "source-drift",
      "compiler-flag-drift",
      "runtime-fallback"
    ],
    "passCode": "PASS-H2N-NUMERICALLY-QUALIFIED-BACKEND-CANDIDATE-ONLY"
  },
  "resultBoundary": {
    "allowedPersistentFields": [
      "identity-hash",
      "error-bound",
      "pass-fail-boolean",
      "timing",
      "resource-field",
      "failure-code"
    ],
    "physicalModelValidationClaimForbidden": true,
    "apparatusClaimForbidden": true,
    "scientificPayloadHumanReadForbidden": true,
    "scientificConclusion": "NONE"
  },
  "safety": {
    "dedicatedFiniteMemoryCgroupRequired": true,
    "systemReserveBytesMinimum": 4294967296,
    "systemReserveMemTotalFraction": 0.25,
    "swapGrowthMaximumBytes": 0,
    "oomEventGrowthMaximum": 0,
    "unrelatedProcessMutationForbidden": true,
    "foreignGpuProcessDisposition": "DEFERRED-H2N-TOOLCHAIN-OR-RESOURCE"
  },
  "failureCodes": [
    "NO-GO-H2N-SOURCE-OR-IDENTITY-DRIFT",
    "NO-GO-H2N-STAGE0-NUMERIC-OR-PERFORMANCE",
    "NO-GO-H2N-FULL-NUMERICAL-QUALIFICATION",
    "NO-GO-H2N-PROVENANCE-LEAK",
    "NO-GO-H2N-RUNTIME-FALLBACK",
    "DEFERRED-H2N-TOOLCHAIN-OR-RESOURCE",
    "DEFERRED-H2N-NO-MATERIAL-END-TO-END-GAIN"
  ],
  "conclusionCeiling": "numerically-qualified-backend-candidate-only-no-physical-validation",
  "h3UnlockForbidden": true
}
